{
  "config_sha256": "<computed_at_runtime>",
  "manifest_hashes": {
    "hosts.tsv": "<computed_at_runtime>",
    "phages.tsv": "<computed_at_runtime>"
  },
  "modules": {
    "safety": {
      "status": "mocked",
      "tool": "mock"
    },
    "similarity": {
      "status": "mocked",
      "tool": "mock"
    },
    "structural": {
      "status": "mocked",
      "tool": "mock"
    }
  },
  "params": {
    "foldseek_evalue_max": 0.001,
    "top_n": 10
  },
  "pipeline_version": "0.1.0-mock",
  "profile": "test",
  "run_id": "2025-12-20T20:00:00Z",
  "shortlist": [
    {
      "confidence_score": 0.92,
      "evidence": {
        "safety": {
          "flags": [],
          "integrase_like": false,
          "tRNA_count": 0,
          "vfdb_hits": 0
        },
        "similarity": {
          "metric": "mock",
          "value": 0.42
        },
        "structural": {
          "best_evalue": 1e-06,
          "hit_count": 3
        }
      },
      "host_id": "H001",
      "next_best_action": "Run plaque assay; if positive, measure EOP and growth conditions.",
      "phage_id": "P001",
      "primary_reason": "mock_structural_support",
      "rank": 1,
      "safety_flags": []
    }
  ],
  "test_mode": true,
  "versions": {
    "colabfold_image_digest": "mock",
    "foldseek": "mock",
    "vfdb": "mock"
  }
}